{
  "manifest_kind": "visual_candidate_batch_preproduction",
  "schema_version": 1,
  "batch_id": "DH-CB-001",
  "tale_id": "drowned_harbor",
  "production_status": "concept_only",
  "created_date": "2026-07-23",
  "entries": [
    {
      "candidate_id": "DH-CAND-001-A",
      "asset_id": "DH-KEY-001",
      "generator": "chatgpt",
      "model_or_tool": "OpenAI image generation via ChatGPT",
      "status": "generated_external",
      "source_kind": "original_ai_assisted",
      "prompt_source": "governed_brief",
      "prompt": "Original storybook-horror key art of an impossible drowned harbor exposed at extreme low tide, theatrical miniature-diorama composition, carved wet timber buildings, oxidized brass mechanisms, swollen paper details, black tidal mud, dominant narrow lighthouse with one restrained amber beam, visible Bellhouse and lifeboat route, hand-inked contours, watercolor and gouache surface variation, stylized controlled 3D depth, strong readable silhouettes, eerie rather than photorealistic, designed for a living-room horror board-game adventure.",
      "negative_prompt": "photorealistic, generic low poly pack, modern harbor, tropical beach, pirate fantasy, steampunk clutter, neon cyberpunk, illegible darkness, heavy bloom, embedded typography, logo, watermark, direct imitation of any existing game or artist",
      "aspect_ratio": "16:9",
      "input_assets": [],
      "third_party_inputs": false,
      "expected_outputs": 1,
      "repository_disposition": "external_candidate_pending_upload",
      "review_status": "unreviewed",
      "approval_boundary": "Concept candidate only. Generation does not approve key art, title treatment, storefront use, production integration, or a Drowned Harbor production Tale."
    },
    {
      "candidate_id": "DH-CAND-002-A",
      "asset_id": "DH-ENV-001",
      "generator": "chatgpt",
      "model_or_tool": "OpenAI image generation via ChatGPT",
      "status": "planned",
      "source_kind": "original_ai_assisted",
      "prompt_source": "governed_brief",
      "prompt": "Playable shared-screen board view of Drowned Harbor at impossible lowest tide, elevated three-quarter camera, storybook-horror miniature town in black tidal mud, clearly separated Salt Market, Bellhouse Square, Lifeboat Shed, lighthouse path, exposed routes with distinct shapes and elevation, wet carved timber, salt-stained slate, oxidized brass, inked contours and watercolor surfaces, controlled cel shading, readable at television distance, atmospheric but not obscured.",
      "negative_prompt": "flat map, photorealistic aerial photo, generic low-poly village, hidden paths, excessive props, modern signage, saturated fantasy colors, fog covering gameplay, embedded text",
      "aspect_ratio": "16:9",
      "input_assets": [],
      "third_party_inputs": false,
      "expected_outputs": 1,
      "repository_disposition": "external_candidate_pending_upload",
      "review_status": "unreviewed",
      "approval_boundary": "Concept candidate only. Generation does not approve board geometry, camera, route readability, accessibility, implementation, or production use."
    },
    {
      "candidate_id": "DH-CAND-003-A",
      "asset_id": "DH-ENV-003",
      "generator": "chatgpt",
      "model_or_tool": "OpenAI image generation via ChatGPT",
      "status": "planned",
      "source_kind": "original_ai_assisted",
      "prompt_source": "governed_brief",
      "prompt": "Original Drowned Harbor lighthouse design, narrow tapered storybook tower built from wet slate and salt-stained timber, oversized lantern room containing a cracked cloudy-glass lens in an oxidized brass radial indexing mechanism, theatrical miniature architecture, hand-inked contours, watercolor surface variation, restrained amber beam shaped as a clean readable wedge, exterior silhouette plus cutaway sense of final decision space, elegant folk horror rather than steampunk.",
      "negative_prompt": "modern lighthouse, steampunk clutter, wizard tower, photoreal postcard, bright clean glass, sci-fi machinery, excessive bloom, generic gothic castle",
      "aspect_ratio": "4:5",
      "input_assets": [],
      "third_party_inputs": false,
      "expected_outputs": 1,
      "repository_disposition": "external_candidate_pending_upload",
      "review_status": "unreviewed",
      "approval_boundary": "Concept candidate only. Generation does not approve final lighthouse geometry, lens behavior, lighting, implementation, or production use."
    },
    {
      "candidate_id": "DH-CAND-004-A",
      "asset_id": "DH-PROP-001",
      "generator": "chatgpt",
      "model_or_tool": "OpenAI image generation via ChatGPT",
      "status": "planned",
      "source_kind": "original_ai_assisted",
      "prompt_source": "governed_brief",
      "prompt": "Original Bellhouse Ledger prop for Drowned Harbor, heavy swollen maritime registry bound in dark salt-stiff leather and oxidized brass, feathered black ink, several overwritten layers of names, simple possible-state symbols, one prepared but unnamed final line, tactile storybook illustration with inked edges and watercolor fiber detail, readable silhouette for a game UI, eerie historical record rather than magical spellbook.",
      "negative_prompt": "spellbook, glowing runes, real names, personal data, generic fantasy tome, secret-traitor symbol, photoreal product photo, embedded readable paragraphs",
      "aspect_ratio": "4:5",
      "input_assets": [],
      "third_party_inputs": false,
      "expected_outputs": 1,
      "repository_disposition": "external_candidate_pending_upload",
      "review_status": "unreviewed",
      "approval_boundary": "Concept candidate only. Generation does not approve final symbols, readable text, UI integration, puzzle behavior, or production use."
    }
  ]
}
